{
  "schema_version": "1.0",
  "cohort_id": "trustworthy_synthesis_v1",
  "source": {
    "name": "OEIS Mathematical Definitions & Curated Benchmarks",
    "revision": "2026-09-04",
    "retrieved_at": "2026-09-04T12:00:00Z",
    "content_sha256": "sha256:3b9d2f003a6b4a1f04cab5b5295851786f8e8fbf914b7ad4b935f64db8605582",
    "license_notice": "CC BY-NC 4.0"
  },
  "observed_horizon": 20,
  "unseen_horizon": 100,
  "targets": [
    {
      "oeis_id": "A000012",
      "name": "The all 1's sequence",
      "offset": 0,
      "family": "CONSTANT",
      "curriculum_stage": 1,
      "observed_terms": [
        "1",
        "1",
        "1",
        "1",
        "1",
        "1",
        "1",
        "1",
        "1",
        "1",
        "1",
        "1",
        "1",
        "1",
        "1",
        "1",
        "1",
        "1",
        "1",
        "1"
      ],
      "unseen_terms": [
        "1",
        "1",
        "1",
        "1",
        "1",
        "1",
        "1",
        "1",
        "1",
        "1",
        "1",
        "1",
        "1",
        "1",
        "1",
        "1",
        "1",
        "1",
        "1",
        "1",
        "1",
        "1",
        "1",
        "1",
        "1",
        "1",
        "1",
        "1",
        "1",
        "1",
        "1",
        "1",
        "1",
        "1",
        "1",
        "1",
        "1",
        "1",
        "1",
        "1",
        "1",
        "1",
        "1",
        "1",
        "1",
        "1",
        "1",
        "1",
        "1",
        "1",
        "1",
        "1",
        "1",
        "1",
        "1",
        "1",
        "1",
        "1",
        "1",
        "1",
        "1",
        "1",
        "1",
        "1",
        "1",
        "1",
        "1",
        "1",
        "1",
        "1",
        "1",
        "1",
        "1",
        "1",
        "1",
        "1",
        "1",
        "1",
        "1",
        "1",
        "1",
        "1",
        "1",
        "1",
        "1",
        "1",
        "1",
        "1",
        "1",
        "1",
        "1",
        "1",
        "1",
        "1",
        "1",
        "1",
        "1",
        "1",
        "1",
        "1"
      ],
      "result_profile": "i64_scalar_v1",
      "terms_sha256": "sha256:2727c3f9525b4dea8185cb2f61ff2078b43086db3c8a258c571216f820e44739",
      "formula_definition_id": "def_A000012_v1",
      "term_fingerprint": "sha256:15eaa23a3b865a35ba143d944f8d8c9c628be82cb784b60240cee40355aece13",
      "program_fingerprints": [],
      "tags": [
        "benchmark",
        "constant"
      ]
    },
    {
      "oeis_id": "A000027",
      "name": "Non-negative integers: a(n) = n",
      "offset": 0,
      "family": "POLYNOMIAL_1",
      "curriculum_stage": 1,
      "observed_terms": [
        "0",
        "1",
        "2",
        "3",
        "4",
        "5",
        "6",
        "7",
        "8",
        "9",
        "10",
        "11",
        "12",
        "13",
        "14",
        "15",
        "16",
        "17",
        "18",
        "19"
      ],
      "unseen_terms": [
        "20",
        "21",
        "22",
        "23",
        "24",
        "25",
        "26",
        "27",
        "28",
        "29",
        "30",
        "31",
        "32",
        "33",
        "34",
        "35",
        "36",
        "37",
        "38",
        "39",
        "40",
        "41",
        "42",
        "43",
        "44",
        "45",
        "46",
        "47",
        "48",
        "49",
        "50",
        "51",
        "52",
        "53",
        "54",
        "55",
        "56",
        "57",
        "58",
        "59",
        "60",
        "61",
        "62",
        "63",
        "64",
        "65",
        "66",
        "67",
        "68",
        "69",
        "70",
        "71",
        "72",
        "73",
        "74",
        "75",
        "76",
        "77",
        "78",
        "79",
        "80",
        "81",
        "82",
        "83",
        "84",
        "85",
        "86",
        "87",
        "88",
        "89",
        "90",
        "91",
        "92",
        "93",
        "94",
        "95",
        "96",
        "97",
        "98",
        "99",
        "100",
        "101",
        "102",
        "103",
        "104",
        "105",
        "106",
        "107",
        "108",
        "109",
        "110",
        "111",
        "112",
        "113",
        "114",
        "115",
        "116",
        "117",
        "118",
        "119"
      ],
      "result_profile": "i64_scalar_v1",
      "terms_sha256": "sha256:22322cb22d651abd553f682e357c45fdf63f26f230b8cf3fc25393925d267309",
      "formula_definition_id": "def_A000027_v1",
      "term_fingerprint": "sha256:7fedb27def8d6497bad58140116f84e90ca901f95f741f39be0113cceb586ceb",
      "program_fingerprints": [],
      "tags": [
        "benchmark",
        "polynomial_1"
      ]
    },
    {
      "oeis_id": "A000217",
      "name": "Triangular numbers: a(n) = n*(n+1)/2",
      "offset": 0,
      "family": "POLYNOMIAL_2",
      "curriculum_stage": 1,
      "observed_terms": [
        "0",
        "1",
        "3",
        "6",
        "10",
        "15",
        "21",
        "28",
        "36",
        "45",
        "55",
        "66",
        "78",
        "91",
        "105",
        "120",
        "136",
        "153",
        "171",
        "190"
      ],
      "unseen_terms": [
        "210",
        "231",
        "253",
        "276",
        "300",
        "325",
        "351",
        "378",
        "406",
        "435",
        "465",
        "496",
        "528",
        "561",
        "595",
        "630",
        "666",
        "703",
        "741",
        "780",
        "820",
        "861",
        "903",
        "946",
        "990",
        "1035",
        "1081",
        "1128",
        "1176",
        "1225",
        "1275",
        "1326",
        "1378",
        "1431",
        "1485",
        "1540",
        "1596",
        "1653",
        "1711",
        "1770",
        "1830",
        "1891",
        "1953",
        "2016",
        "2080",
        "2145",
        "2211",
        "2278",
        "2346",
        "2415",
        "2485",
        "2556",
        "2628",
        "2701",
        "2775",
        "2850",
        "2926",
        "3003",
        "3081",
        "3160",
        "3240",
        "3321",
        "3403",
        "3486",
        "3570",
        "3655",
        "3741",
        "3828",
        "3916",
        "4005",
        "4095",
        "4186",
        "4278",
        "4371",
        "4465",
        "4560",
        "4656",
        "4753",
        "4851",
        "4950",
        "5050",
        "5151",
        "5253",
        "5356",
        "5460",
        "5565",
        "5671",
        "5778",
        "5886",
        "5995",
        "6105",
        "6216",
        "6328",
        "6441",
        "6555",
        "6670",
        "6786",
        "6903",
        "7021",
        "7140"
      ],
      "result_profile": "i64_scalar_v1",
      "terms_sha256": "sha256:22549e984929c38a0f1c9ff30e742eb4b5bea99a24883f1b149cf9fd728ec873",
      "formula_definition_id": "def_A000217_v1",
      "term_fingerprint": "sha256:9c593187f3b365e5f6afa7c2b8cba2ea1e0f2a1e7e1c8e9b942bfe7bd57936ab",
      "program_fingerprints": [],
      "tags": [
        "benchmark",
        "polynomial_2"
      ]
    },
    {
      "oeis_id": "A000290",
      "name": "The squares: a(n) = n^2",
      "offset": 0,
      "family": "POLYNOMIAL_2",
      "curriculum_stage": 1,
      "observed_terms": [
        "0",
        "1",
        "4",
        "9",
        "16",
        "25",
        "36",
        "49",
        "64",
        "81",
        "100",
        "121",
        "144",
        "169",
        "196",
        "225",
        "256",
        "289",
        "324",
        "361"
      ],
      "unseen_terms": [
        "400",
        "441",
        "484",
        "529",
        "576",
        "625",
        "676",
        "729",
        "784",
        "841",
        "900",
        "961",
        "1024",
        "1089",
        "1156",
        "1225",
        "1296",
        "1369",
        "1444",
        "1521",
        "1600",
        "1681",
        "1764",
        "1849",
        "1936",
        "2025",
        "2116",
        "2209",
        "2304",
        "2401",
        "2500",
        "2601",
        "2704",
        "2809",
        "2916",
        "3025",
        "3136",
        "3249",
        "3364",
        "3481",
        "3600",
        "3721",
        "3844",
        "3969",
        "4096",
        "4225",
        "4356",
        "4489",
        "4624",
        "4761",
        "4900",
        "5041",
        "5184",
        "5329",
        "5476",
        "5625",
        "5776",
        "5929",
        "6084",
        "6241",
        "6400",
        "6561",
        "6724",
        "6889",
        "7056",
        "7225",
        "7396",
        "7569",
        "7744",
        "7921",
        "8100",
        "8281",
        "8464",
        "8649",
        "8836",
        "9025",
        "9216",
        "9409",
        "9604",
        "9801",
        "10000",
        "10201",
        "10404",
        "10609",
        "10816",
        "11025",
        "11236",
        "11449",
        "11664",
        "11881",
        "12100",
        "12321",
        "12544",
        "12769",
        "12996",
        "13225",
        "13456",
        "13689",
        "13924",
        "14161"
      ],
      "result_profile": "i64_scalar_v1",
      "terms_sha256": "sha256:effe0e3d0c929e9aecedf1befab2c09aa3fcca86108a59add27b0b4ff845aa8e",
      "formula_definition_id": "def_A000290_v1",
      "term_fingerprint": "sha256:f26968f5bc7d2d372c4d808ad923016207317a22867194bc6beb37a1823f3a97",
      "program_fingerprints": [],
      "tags": [
        "benchmark",
        "polynomial_2"
      ]
    },
    {
      "oeis_id": "A000578",
      "name": "The cubes: a(n) = n^3",